{
  "dataset_origin": "earnings-research-os",
  "formal_evidence_created": 0,
  "frozen_source_commit": "a738d2ded66e790fba5d155b5f50a50df7a81dc6",
  "mapping_version": "earnings-research-os-29-column-v1",
  "migration_recorded_at": "2026-08-26T07:20:00+09:00",
  "migration_version": "v1",
  "output_sha256": {
    "field_history.jsonl": "b75a1e9c6b3e22bbbbdd4dd2bf9f3abfa62c2dcc3b41b169b47a9481b7eb99ac",
    "legacy_context_view.jsonl": "8abdf5419f4f65092be75103d9ebed93ab86408ce4605f778b1bfaaea674494a",
    "legacy_records.jsonl": "f31d946f320e079ed201648da8f8a3a7f387d1a17492361f3cec0bc9666fcdc9",
    "source/dashboard.md": "c6caccd6c236a346af6eb32a2c7b7d9ecb67fd51c536bb9220c3f2f6b4aab5c2",
    "source/note_draft.md": "34c98a2500d48112ce757d8e06204cbb42d24acc6758bac32c901202bf6c1aa7",
    "source/records.csv": "694a2605272bbdce950f32b19c571f269bcff92dea5238d66cbf3f2b5e294327",
    "source/tso/ers_legacy_context_link.csv": "fbb0a6928bc3db118b0c57d1a4c9faf59684ec2c493da469197b0b3d16b3d1e7",
    "source/tso/market_context_historical.csv": "8a9dd50105d7a5b64112d9438eae772c0563b0892b8c855122906cb73ece2258",
    "source/weekly_report.md": "c62c8ecef80ec481dfa14c549722e30da3a2a21f559691bf3e17f367f3f992b9"
  },
  "prospective_records_created": 0,
  "record_mode": "legacy_observational",
  "schema_version": "legacy_migration_manifest_v1",
  "source_branch": "main",
  "source_column_count": 29,
  "source_first_commit": "46dc58c5f34e529bfcc732578b6fdb439568111a",
  "source_header": [
    "code",
    "name",
    "date",
    "quarter",
    "rank",
    "surprise",
    "company_forecast",
    "rc1",
    "rc2",
    "rc3",
    "narrative",
    "judge",
    "buy_condition",
    "exit_condition",
    "memo",
    "prev_close",
    "next_open",
    "next_close",
    "d5_close",
    "d20_close",
    "gap",
    "ret_d1",
    "ret_d5",
    "ret_d20",
    "shodo",
    "reaction",
    "result",
    "error_type",
    "review_note"
  ],
  "source_history_commit_count": 53,
  "source_last_commit": "a738d2ded66e790fba5d155b5f50a50df7a81dc6",
  "source_path": "data/records.csv",
  "source_repository": "https://github.com/Tadaim2tk/earnings-research-os.git",
  "source_row_count": 254,
  "source_sha256": "694a2605272bbdce950f32b19c571f269bcff92dea5238d66cbf3f2b5e294327",
  "source_workflow_run_id": "32839916267",
  "tso_context_snapshot_count": 88,
  "tso_join_status_counts": {
    "ok": 254
  },
  "tso_link_row_count": 254,
  "tso_repository": "https://github.com/Tadaim2tk/tactical-swing-os.git",
  "tso_source_commit": "f062111fe769c0104a444bb731969dc51620e115",
  "tso_writeback_performed": false
}
